,Title,Account,ID,Text
48,日本风情画|ToyotaJPNTaxi日本试驾体验，新一代都会亲善大使,SSCS,ab735a258a90e8e1-6bee54fcbd896b2a-42fbaaae408095ba71160b53260ea4af,有一种移动工具，相信你我都曾经搭过，就是我们俗称的「小黄」计程车，最早可以在路边挥挥手，随时载你前往目的地，现今还加入了APP叫车程式，可预约到府接送，甚至可以指定特别功能车款。在全世界各地，计程车可说是都会区的象徵，例如管理机关规定车色的「小黄」、「Yellow Cab」，东南亚地区独有的摩托计程车、三轮车，德国常见的「双B」计程车，或是英国计程车「Black Cab」等，同时反映各地的交通文化；这次为各位介绍的，即是来自日本的代表「JPN Taxi」，这是什麽样的一款车，用以取代1995年推出自今的「Crown Comfort」计程车，本回试驾体验报导告诉你！在许多大都市担任重要交通运输任务的计程车，通常主管机关会针对规格、用途或是安全性进行规范，在某些国家也会依照使用需求与当地文化推出计程车专属车型，例如文前提到的英国计程车，如果各位曾到英国伦敦旅游，一定会对街上穿梭的复古造型计程车印象深刻；包括从二次世界大战后，由Austin车厂推出的FX4计程车，或是后来接替其地位的TX2、TX4计程车，数十年来维持复古典雅造型、长轴距带来的大车室空间等特色；本回介绍的JPN Taxi，造型就是参考英国计程车的复古设计，其实它的底盘平台正是来自国人熟悉的Toyota Sienta。在JPN Taxi问世之前，日本的计程车主流车款为Toyota于1995年推出的Crown Comfort，各位若前往日本、香港等地旅游，应该都有看过这款计程车，但可别以为这些车年纪都很大，其实Crown Comfort自1995年推出之后，持续生产至2017年，拥有超过20年的生产历史，这款用以投入计程车市场的大型房车，主要搭载2.0升LPG天然气引擎，造型气派、车内空间充足，20多年来在日本计程车市场扮演重要的角色。2017年东京车展正式发表的JPN Taxi，就是用以取代服务20多年的Crown Comfort计程车，它还担任一个重要角色，就是2020年东京奥运会举办时，将带给全球旅客深刻且良好的搭乘印象，所以在车上就能发现许多巧思，包括空间规划、便利的无障碍设施、舒适的乘坐感等；JPN Taxi推出一年多来，在日本大都市的街头能见度愈来愈高，尤其在东京市区已有逐渐赶上Crown Comfort数量的趋势，复古造型十分抢眼，成为日本都会街头的一大亮点。 为了更深入介绍JPN Taxi，于是我们前往东京台场的「Mega Web」，近距离研究现场的展示车与实际试驾体验这辆新世代计程车。 虽然本车是以Sienta的底盘平台为开发基础，不过从外型上不容易看出两车之间的关联性，JPN Taxi的车长为4400mm、车宽1695mm、车高1750mm，轴距为2750mm，也就是说JPN Taxi的体型虽然不算大，但藉由高车身与长轴距设定，带来更宽敞的车室空间；功能方面也有许多特色，例如左右车门採用不同的开启方式，其中靠近人行道侧的左车门（日本为右驾，因此乘客上车方向与台湾相反）为滑门设计，便于乘客上下车辆，靠近道路侧的右车门则是传统开启方式，主要是能让后方来车得知将有乘客下车而特别留意（当然开车门时要多注意后方）。照片中可以看到左侧车门採用电动滑门设计，大面积开口便于乘客进出。附有无障碍设施的JPN Taxi会在车上准备一套专用器材组，包括折叠式轮椅坡道、轮椅固定装置等，再利用侧滑门设计带来的大面积进出口，便于乘坐轮椅的乘客上下车辆，这也是以往Crown Comfort计程车所欠缺的功能。 右侧车门为传统开启方式，其车窗採用固定式设计。照片中另可看到驾驶座与其他座椅採用不同的配色，其泡棉软硬度也不同，驾驶座採用支撑性较高的设定，乘客座椅泡绵较软，有一种坐在沙发椅上的感觉。JPN Taxi分成「匠」与「和」两个等级，日本当地基本售价各为349.92万日圆（约台币97万元/台币）与327.78万日圆（约台币92万元/台币）；这辆展示车即是等级较高的「匠」车型，外观有几个地方可以辨识，包括「匠」採用LED头灯，后视镜、车门把手等採用镀铬设计；「和」为传统型卤素头灯，外观採用镀铬件的比例较少。后视镜设置于叶子板前端两侧，复古风格十足，而Crown Comfort计程车也是採用相同的设计。「匠」车型採用这款样式比较複杂的镀铬轮圈盖设计，配胎尺寸为185/65R15。 尾灯採用直立式设计，拥有相当好的辨识效果。 内装设计相当简洁，主要控制功能与按键都设置在驾驶座周围，照片中可同时看到以颜色区隔驾驶与乘客座席区域；JPN Taxi先天就是用以设计担任营业用车，因此内装配备规划与一般车辆有些不同，例如中控台连接仪表台的区域相当紧密，几乎全车的控制功能都集中在此，一旁的副手座席显得简洁十足，也未有一般车辆常见的手套箱设计，所以可腾出更多的腿部放置空间。另外还可见到位于中控台上方的空调出风口，面积也比一般车辆小，主要是原厂设计出风口将风向导流至上方，驾驶座后上方的位置设计了一组进气孔，然后再将空调气流导引至后座出风口，以增进后座的空调效率。安全配备方面，JPN Taxi将TSS系统列为标准配备，整合包括预防碰撞警示、车道偏离警示、自动远近光灯；同时也将前车行进提醒功能、盲点侦测、斜坡起步辅助等列为标准配备，加上六具气囊的配置，整体主被动安全已有出色水准。仪表板设计相当简洁，除了时速表之外，一旁的液晶萤幕提供Hybrid系统运行状态、燃料量、档位、里程等资讯。 JPN Taxi的方向盘功能有个很特别的地方，就是除了一般常见的选单控制按键之外，竟把警示双闪灯按键设置在方向盘上，其实这与日本的驾驶习惯有关。如果各位曾在日本租车自驾旅游，就可以发现日本驾驶对于双闪灯的用途，在于交通礼让方面；举例来说，在东京首都高速公路汇入主线车道前，打方向灯准备切换车道时，后方来车通常会减速礼让，驾驶汇入车道后就会以双闪灯表达致谢，这对于经常载客而要停靠路旁的计程车司机来说，是一项经常使用的功能，因为乘客上车后，车辆准备切入主车道前，后方车辆见到计程车打右方向灯进入车道，后方车辆会减速礼让，此时计程车司机就会以双闪灯表示致谢。变速箱採用CVT无段式配置，并附B档位可在下坡时增加引擎煞车力道加速Hybrid电池的回充效率；并将车内灯、纯电模式、行驶警示音等开关按键设置于排档座旁。 空调面板设置于驾驶座靠近车门的地方，主要是中控台已设置计费表，所以将空调面板移到此处（或许司机不希望乘客自己伸手控制空调）；另外在下方可见TSS功能、电动侧滑门开关等按键。计程车司机可控制侧滑门电动启闭功能，从车窗控制面板中能看到右后窗为固定不可开啓式设计。后视镜上方的电子时钟的显示萤幕相当大，便于后座乘客看时间。少了手套箱之后，副手座前方的空间可说是相当宽阔，也不需刻意调整座椅前后位置，乘客上下车相当便利。 后座採用三人座规划，座椅泡棉相当软，就像坐在沙发一样。 前座椅背后方设置了把手，还有两组2.1A USB插孔，便于乘客搭车时进行充电。 后座除了设置阅读灯、空调出风口之外，还加入电热椅功能，乘客在冬天搭车时能享有更好的舒适度。 驾驶座旁的托盘是用来乘客付钱、司机找钱等功能，并设置感应卡机器，便于使用交通储值卡、信用卡等付款方式。后座两旁设置了类似公车拉环的设计，上下车或行驶于山路时相当好用。 中控台下方为收据列印机，前方按键则是后座出风口、电热椅功能的控制开关。 后座出风口设置于上方，主要就是吸进前出风口的气流后，再透过风扇将冷风或热风吹向后座。后座空间相当大，我们请身高181公分的同事先调整好前座的习惯坐姿后，再坐进后座仍保有充足的膝部空间。 高车顶的规划方式，同时带来出色的头顶空间，加上平整化的地板，的确是一辆专为后座乘客所设计的车款。  在标准座椅配置状态下，JPN Taxi的行李厢容积为401公升，放入可折叠式的轮椅也不是问题。若不具日本营业小客车驾驶的身份，一般来说并不容易亲身驾驶JPN Taxi上路，但在东京台场的Mega Web，目前开放一般民众可试驾体验这款新世代日本计程车，因此我们也预约了试驾名额，在规划场地内短暂体验JPN Taxi。JPN Taxi的动力系统採用原厂代号「1NZ-FXP」的1.5升油电混合动力引擎，与日规Sienta Hybrid系出同源，不过其差异在于燃料换成了LPG天然气，也是一般常见的营业用车燃料类型；这套动力系统的最大综效动力为100ps，电动马达的最大扭力输出为17.2kgm，平均油耗为19.4km/L（日本JC08测试标准），动力帐面数据不算亮眼，但对于常于都会区行驶的计程车而言，已算是够用。开著JPN Taxi上路后，初步的感觉是动力反应其实比想像中来得轻快，虽然不是那种踩下油门就衝劲十足的感觉，而且过弯时就可感觉到车身其实有些沉重，但平顺、柔和、震动感不明显的加速过程，可以预见的就是乘客在后座不容易感到不适，只要油门控制得宜，车辆行进间不会出现顿挫感，辅以低速状态下能以纯电模式行驶，是一辆很容易上手与控制，乘客又能坐得舒适的车辆。副手座头枕刻意降低了头枕高度，使得后座乘客拥有更佳的前方视野。 位于前方的后视镜仍可透过电动按键调整位置，从驾驶座看出去的角度就如照片中所示。虽然仅是短暂试驾体验，但也找到许多喜爱JPN Taxi的理由，包括轻鬆好上手的动力反应，以及便于驾驶人控制的功能按键规划，并拥有良好的前方视野，也藉此减少驾驶人的开车压力，让「运将」上路时的心情更加轻鬆。对于乘客，JPN Taxi的规划十分全面，包括针对乘客舒适度所设定的座椅泡棉软硬度、便于上下车的电动侧滑门、宽敞的乘坐空间、良好的前方视野，以及电热椅、充电孔、独立出风口等机能，面对日本高龄化的社会，本车也规划出色的无障碍设施，能满足更多乘客的需求，也难怪JPN Taxi推出之后，就连香港、新加坡等计程车业者都感到浓厚的兴趣，说不定将来除了日本之外，也能在其他右驾国家见到本车的身影。 Toyota JPN Taxi规格诸元表引擎型式：直列四缸 DOHC 16V Hybrid+LPG排气量：1496c.c.引擎最大马力：74ps/4800rpm引擎最大扭力：11.3kgm/2800~4400rpm电动马达最大扭力：17.2kgm综效最大马力：100ps驱动方式：前轮驱动变速箱型式：CVT无段变速煞车结构：四轮碟煞前悬吊结构：麦花臣后悬吊结构：拖曳臂轮胎规格：185/65R15车身尺寸：4400mm x 1695mm x 1750mm轴距：2750mm车重：1410kg燃料容量：52公升图/文：mobile01—— 回顾往期 ——本田党 | 泰国Endless代理的十代思域DemoCar改装欣赏！本田党 | 本田S2000玩得这么帅，每次都只能继续默默舔屏羡慕！本田党 | 洗车是借口，聚会是真的！泰仔十代本田思域小聚！别人的两箱十代思域看着就是帅！不过这类改装风格才是真正值得推荐的！哥！厉害啦！还有这种操作？转子机器的日产飞鸡S13！？日本风情画 | StanceNation Japan 2018 年度压轴台场日本姿态党大聚会图集！Pt.2日本风情画 | StanceNation Japan 2018 年度压轴台场日本姿态党大聚会图集！Pt.1每次看到你们把本田S2000玩得这么帅，都只能默默舔屏羡慕！—————————————
49,【四转开篷】ToyotaCelicaConvertible（ST183）粤语旁述,唐龙汽车,ab735a258a90e8e1-6bee54fcbd896b2a-5d02f1de450122313c84634aa1290d1c,每天为您提供以下精彩汽车内容热点案例视频资讯其他      这次的Celica Convertible属于第五代的T180系的ST183车型，是Celica的开篷型号，其实早在1979年的TA40已经有开篷版本，当时叫做Celica SunChaser，不过当年的开篷是附有支架，不是全开篷，有点像Targa，直至最后一代后驱Cellica（TA60）才有全开篷版本，同样的，第一款前驱Celica（T160）也延续全开篷版本。播放            至于眼前的ST183 Celica Convertible由位于美国加州的ASC公司负责制造，同样采用全开篷设计，中间没有任何防翻保护架，置身其中开扬度极大，不过由于是早期设计，所以车内乱流极大。      泪滴型倒后镜其设计具有降低风阻能力。      门板上镶有Celica Convertible字样，童叟无欺。      那些年的开篷车主要以软篷为主，尾窗为透明软胶。      开篷后，整体形能更加好看，其格仔尾灯也这代Celica的特色。      日本车主已换上跑车款的四点式方向盘，原装味虽欠奉。      简单的三圆表，中间为速度表，左边为转数表，右边为水温、电量及油表，另外，波档显示设于表板左下方。      上手日本车主已换了一对熟口熟面的桶椅，由于车主不是追求原装，所以到港后也未有换回原装座椅。      开篷版Celica配一台编号3S-GE的一代名机，2公升DOHC 16V自然吸气设计，最大马力有165匹，最大扭力有19.5kgm。      虽然今次的ST183只配4速自动波，加速反应未及手波爽快，但由于这个版本备有四轮转向（4WS）功能，操控上更胜一筹，特别在连续弯路上，比同期前驱版本更活泼。
50,TOYOTALandcruiser“70”重温经典①,越野视界,ab735a258a90e8e1-6bee54fcbd896b2a-862e8b8b8de6abc06a86af512e2d819d,===  ↑ 越野人关注的  ===都在这里如果你要远方，它将和你一路同行，无论去多么遥远的地方它也能安全带你回家！TOYOTA Landcruiser “70” Series播放「 序 . LANDCRUISER诞生 」Landcruiser history丰田陆地巡洋舰始于朝鲜战争初期，占领日本的美国军队进驻朝鲜半岛时需要一款扎实耐用且通过性能优越的吉普车，为了赢得合同，丰田开发了一款名为“ TOYOTA BJ ”的原型车！但美国最终却采用了其他公司的设计。丰田公司并没有因此放弃，其后在与美国威利斯吉普一起竞标国家警察部门后勤采购计划中胜出，BJ系列得以大量投入在日本国内消防，军警，林业，农业等各领域广泛使用。当人们驾驶“ TOYOTA BJ ” 爬到富士山6号检查站时，BJ系列证明了自己，长期的日常使用中它赢得了坚固耐用且通过性能出众的极高声誉！• 1955年，丰田 “JEEP BJ ”更名为“ Landcruiser ”，一个传奇就此诞生。陆地巡洋舰在各个领域里证明了自己的卓越性能，并在沙，雪，沼泽，矿场以及几乎所有无法想象的恶劣使用条件下证明了自己的可靠性。陆地巡洋舰成为世界上许多偏远禁区的首选车辆。• 1960年，BJ型向40系列迈进了一步。FJ40系列的外观对于日本国内4x4市场来说是划时代的。强悍的越野性能远超BJ系列，并拥有无与伦比的可靠性和耐用性，它在世界上最偏远地区创造无数传奇般的记录和口碑，截止1984长达24年的时间里，FJ系列（包括20系列）外观几乎没有变化，只是从内部不断改进。FJ40系列成为越野史上最经典的车型，迄今为止依然活跃在世界最艰苦的地区！1984「 第一代70系列 」• 世界上有几种适合环球冒险旅行的基础车辆，但很少能拥有Landcruiser 70的可靠性和耐用性，70系列无需改装即可完成全球重度穿越之旅。• 如果你要远方，它将和你一路同行，无论去多么遥远的地方它也能安全带你回家！（内容来自越野e族陆巡7系）— 未完待续 —越野视界
51,【再战赛场】预告投入GT4级别赛事ToyotaGRSupraGT4Concept日内瓦车展试水温,唐龙汽车,ab735a258a90e8e1-6bee54fcbd896b2a-2c6391a142f1658102ba2de144f8969e,每天为您提供以下精彩汽车内容热点案例视频资讯其他      在2019日内瓦车展上，Toyota将全球首演崭新的GR Supra GT4 Concept概念赛车，这款以第五代 A90 Supra 市售车为基础的概念赛车，不仅是顺应全球GT4级别赛事规范而生。      更要提供予一般私人参赛者、或私人车队一款易于入手的GT4参赛用车，同时更将藉由Toyota全球后勤网络辅助，以进一步推广基层的赛车运动。      市售版本的GR Supra车型，以近乎完美的前后配重、双人座座舱设定、兼具轻量化及高刚性的车体、后轮驱动、与极低重心的设定，让它成为进军GT4赛事的最佳基础。      而短轴距与宽轮距所构成的1.55「黄金比例」，更提供予A90 Supra车系绝佳的操控稳定性及灵活性，而GT4赛制因应各参赛车款引擎出力所调整的车重，也使得GT4赛场上的竞争更具可看性。      GR Supra GT4 Concept是由Toyota Gazoo Racing所开发，这款概念赛车在保有GR Supra市售车低趴、充满肌肉线条的车身造型之外，在车长及车高更一并加长、压低，而专属设计的前保杆下扰流、与车尾的大型尾翼，更能降低GR Supra GT4 Concept在高速行车时的空气阻力。            同时强化下压力，而这两处专属的空力套件，并运用大麻、及亚麻的天然纤维复合材质打造，四轮足下并置换为五孔的OZ 11J x 18寸赛车专用铝圈。      引擎盖之下，GR Supra GT4 Concept也沿用源自BMW的B58 3.0升直六双涡流涡轮汽油引擎，并搭配自排变速箱传动，出力性能的提升，则藉以赛事规格的ECU、及专属接线器提供，另外GR Supra GT4 Concept包括传动轴、及限滑差速器等，同样也採用竞赛等级的部品。      GR Supra GT4 Concept在座舱内将所有非必要的舒适化配备全数卸除，并装上高强度的防滚架，以及FIA认证的灭火器、及OMP赛车桶椅，而这款概念赛车同样配置赛车专用的油箱、及燃油快充系统。      GT4级别赛事为全球成长最为迅速的赛车运动之一，并于欧洲、北美、亚洲、大洋洲等区域国家均有专属的系列赛事。      GT4等级赛事于2006年由FIA所认可创立，该项赛事是为提供予职业、甚至业馀车队及车手一项高C/P值的GT赛事选择，更是潜在能让私人车队及车手跃升GT3级别赛事的基石。      Toyota Gazoo Racing将藉由日内瓦车展上潜在客层的反应及回馈，来决定GR Supra GT4 Concept今后的发展、以及步入市售化的可能性。
52,包头信得惠丰田汽车公司招聘,包头人才协会,ab735a258a90e8e1-6bee54fcbd896b2a-1cabf6cd9ec42d49029d4229e0bd4b56,招聘岗位：钣金主修工任职资格：1、品行端正，能吃苦耐劳、服从分配；2、良好的团队合作精神；3、二年以上汽车维修工作经验，有4S店工作经验者优先考虑。岗位职责：1、对车辆进行钣金检查和维修；2、对工具、设备进行定期保养；3、按照车间主管安排工作任务及时完成。薪资：4000-8000元联系电话：0472-5188025工作地址：包头青山五一市场   包头信得惠丰田汽车销售服务有限公司坐落在包头市青山区友谊大街31号，是一汽丰田在包头地区的指定经销商。公司创建于2004年6月26日，经过多年的奋斗，现已拥有员工上百人，年销售2200台，年维修台次30000台，占地面积6000多平方米，建筑面积4000多平方米，是包头乃至西部地区一汽丰田规模最大的4S店之一。包头市东河区审计局招聘包头万达儿童娱乐有限公司招聘内蒙古自然博物馆招聘包头市家伟贸易有限公司招聘内蒙古百仕力工业公司招聘
53,全新一代ToyotaCoaster,南浦行舟,ab735a258a90e8e1-6bee54fcbd896b2a-e5d563dd9c831ec474ecbf50d9c5cea0,全新一代丰田考斯特Toyota Coaster 19座小巴欲回顾#手绘广州的士#系列内容，请点击以下链接：欲回顾#手绘广州巴士#系列内容，请点击以下链接：第一季第二季第三季第四季第五季第六季第七季第八季第九季第十季往期手绘作品回顾：德系情怀老车 #W140手绘作品感谢您的欣赏
54,قىقاسTOYOTAكامرۇيسىتىلىدۇ,新疆二手工程机械信息平台,ab735a258a90e8e1-6bee54fcbd896b2a-70820a228b15d7c298e2b6a3d6c2335b,代发TOYOTA kamroy小车急卖，细节打电话 13579067235地址: 图木舒克تويۇتا كامرۇي جىددىي سىتىلىدۇ ، تەپسىلاتىنى بىلمەكچى بولسڭىز تىلفۇن قىلىڭ13579067235ئورنى: تۇمشۇق شەھەرسالۇنىمىزغا داۋاملىق ئىلان قۇبۇل قىلىمىز
55,2019款TOYOTA国产考斯特改装_报价及图片指定5S店,北京平行金港商务车,ab735a258a90e8e1-6bee54fcbd896b2a-bc78714930bfe80fb624bfffc8021f3e,"国产平行金港COASTER柯斯达从车内装潢到车身设计、从内到外各个方面都达到最高水平。加之一汽丰田始终将客户的利益放在第一位，使得柯斯达及其系列特装产品在市场上的美誉度与日俱增，市场销售业绩日与俱增,丰田COASTER柯斯达追求高品质与车型多样化的脚步从未停歇，在秉承TOYOTA一贯执著品质的原则下，丰田COASTER柯斯达在性能上充分契合中国环境与道路的特点，流畅的外观更映衬出新时代的风景。在秉承TOYOTA一贯执著品质的原则下，丰田COASTER柯斯达在性能上充分契合中国环境与道路的特点，流畅的外观更映衬出新时代的风景。平行金港丰田考斯特有众多的人性化配备，包括电动伸缩踏板、高制冷可制冰的车载冰箱等等，舒适的航空座椅使旅途不再劳累。丰田柯斯达/考斯特新增了隔热隐私玻璃，各种镀铬装饰以及镀金标识，庄重感与豪华感油然而生。车内还配备了吸顶式电视，可以在车内打发闲暇的时间。宽敞舒适的车厢，使COASTER看起来就象家庭轿车一样。此车还配备了自动门，让上下进入此车的人更加方便。国产COASTER考斯特改装商务车从内饰的设计上说注重舒适和安全性能考虑。首先从驾驶席的改装上来说，为了让驾驶员有一个更加舒适的状态，丰田考斯特改装商务车改装可以将座椅加宽加大并且可以增加扶手。增加司机置物盒，以及方向盘的半桃木装饰，仪表盘的边框桃木装饰，丰田考斯特改装，在内饰的设计为驾驶员提供足够的舒适保障行车中的安全。平行金港丰田考斯特内饰的舒适设计还体现在乘客席内饰的独特设计上，即使丰田考斯特虽然座位数较多，但是并不会显得拥挤，座椅增加真皮，在提升舒适感的同时也让丰田考斯特在内饰的设计上显示的档次感十足。其次平行金港丰田考斯特改装从外观的设计上来说，丰田考斯特改装商务车车身全长7005mm,车身宽度2040mm，车身全高度2631mm,高大端庄的外形设计在给您带来舒适的坐乘空间的同时也在显示了高大上的设计并且合理的曲线设计，镀铬防蹭条在增加车身保护的同时也增加了车身的层次感，并不会因车身得高大而显得笨拙。丰田考斯特流线型的车头设计独特的坡度设计形神俱在，不失端庄的同时也带有俏皮之感，更以减少视野盲区为目的进行了配置的改进，让我们的行程更加安全。扫描二维码或直接拨打热线电话，咨询了解更多详情！13910522893"
