,Title,Account,ID,Text
0,丰田汽车公司最想收藏的一辆丰田轿车,老车资料库,ab735a258a90e8e1-6bee54fcbd896b2a-53a60729fe1d9168d3982f816a56b6d1,丰田汽车公司成立于1937年，而第一款量产的丰田轿车则问世于1936年。从丰田汽车公司成立到现在，丰田公司设计和生产了数百款轿车，丰田公司总部汽车博物馆内的各种经典车能让到此参观的车迷大饱眼福。 不过，有一款非常重要的车型丰田汽车公司缺失了，丰田公司量产的第一款轿车；丰田AA。丰田AA轿车于1936年开始批量生产，到1943年停产前总共生产了1404辆。作为丰田第一款量产车型，它的技术参考了三十年代中期的美国轿车，最大功率62马力的3389毫升排量6缸发动机是雪佛兰发动机的仿制品，电气部分仿的是福特轿车电器系统，流线造型学的克莱斯勒气流轿车。二战结束时日本变成了穷光蛋，人人都在为下一顿饭而奔忙，填饱肚子再说谁还有心思管其它事情。正确的发展方向+经过二、三十年的努力工作，日本成为世界第二经济发达的国家。1987年，丰田汽车公司已经是世界排名前几位的汽车公司并迎来了它成立五十周年大庆的纪念日（看看丰田汽车成立五十年时取得了什么样的业绩，再对比国内那些共和国的亲儿子们，真是差距啊！）。五十周年大庆必须得有一辆第一款量产的丰田轿车撑场子。这时，丰田公司悲催地发现，全日本一辆丰田AA轿车都没有了，只好造了辆AA轿车的复制品。当然，并不是所有AA都变成了废铁和零件，2008年，终于在俄罗斯海参崴的一个农民家里终于发现了一辆丰田AA轿车。这辆车于1936年出口苏联，还是丰田生产的第一批次AA轿车（100辆）中的一辆。具原车主介绍，这辆车在当地的农庄里用了几十年。荷兰的 Louwman博物馆决定收藏这辆独一无二的孤品轿车，他们的专家检查了一下这辆车，发现历经几十年的风雨，这辆锈迹斑斑、车身钣金没一处是平整的车只有外壳还是原来丰田制造的。是啊，二战结束后原装的丰田零部件断了来路，但是车还得用。因而，在苏联能工巧匠的手中，它的雨刷、仪表、车灯、电器部分和机械部分陆陆续续都换成了苏联货。仪表换成了GAZ51卡车的，原来AA没有转向灯（现代的闪烁式转向灯是1938年才首次应用在汽车上的高级配置，生产这辆AA时的1936年还没有它），苏联人给加上了。原装的AA是单支雨刷且安装位置在风挡上端，后来也换成了GAZ51卡车的，改成了双支雨刷安装位置变成了风挡下方。发动机变速箱也来自GAZ51卡车（原来的丰田发动机早已不知所踪，），这辆车的发动机罩也是重新敲的。魔改之下，这辆AA已经和原车几乎完全是两回事了，丰田的外壳+GAZ51的心脏和部件，技术水平也比原车有了长足的“进步”。最终，荷兰Louwman博物馆决定对这辆车原装度不到一半的车不做翻新直接展出，让参观者感触岁月在它身上留下的痕迹。 
1,TamiyaToyota4×4MountainRider皮卡,RCFans遥控迷,ab735a258a90e8e1-6bee54fcbd896b2a-060dcedc965e34db183bf22d256febaa,"“玩模型 关注RCFans”Tamiya田宫模型将推出1/10 Toyota 4×4 Mountain Rider pick-up truck，这款皮卡是基于Toyota 
Hilux再造车架采用和实车类似的梯形结构，传动系统配备3档齿轮箱(1挡为4WD、2和3档位2WD)，支持行走过程中换挡。除了仿真的底盘结构和车壳，悬挂部分Tamiya也把仿真做到了极致，包括金属车桥、钢板弹簧、123mm直径轮胎都出现在新车上。2019年4月上市，产品编号47394。选购请进入https://shopwaigo.com/cn点击“阅读原文”参与互动欢迎在微信发表评论关注RCFans微信订阅号，每天为您带来最新RC资讯网站 http://www.rcfans.com微博搜索 rcfans今日头条搜索 rcfansAPP Store搜索 rcfans"
2,Toyota丰田汽车欧洲总部招聘品牌传播实习生，坐标布鲁塞尔,法国红领巾,ab735a258a90e8e1-6bee54fcbd896b2a-4d1648fa537ded64cb3e2f7067331571,"欧洲地区工作Toyota Motor Europe HQ (Brussels)※ 工作岗位：Internship Brand Communication, Social, Olympics/paralympics※ 工作地点：Brussel※ 工作时间：12 months※ 工作内容：Project management and support related to social media, social listening & reporting, influencer activations & events, and editorial; Support the team on projects related to Toyota’s Olympics & Paralympics partnerships;Support in preparing presentations, analysis or internal documents for key stakeholders and management;General department support (coordination, budget administration, follow up with NMSCs.※ 招聘要求：Student in final year study (degree: Marketing, Sports Marketing, Communication, Social Media or related);Good knowledge of (international) communication with good affinity and interest in digital and social media technologies;Experience with social analytics/monitoring/listening/engagement tools is a plus;Interest in automotive is a plus;Strong analytical and organisational skills combined with a creative spiritFlexible team player;Hands-on mentality;Skills: MS Office suite, social media channels and tools;Fluent in English, any other European language a plus.※ 简历投递：https://intern-toyota-europe.icims.com/jobs/2377/internship-brand-communication,-social,-olympics-paralympics/job?mobile=true&needsRedirect=false或点击 阅读原文 进入官网投递简历从2个月以前红领巾开始推送欧洲/国内实习工作信息以来，小满老师每天都会收到来法国/国内来咨询求职的同学们的好友申请。“更多的欧洲实习信息要在哪里找？”“小满老师你帮我看下我的CV这样写可以吗？”“我在网上下的模版写的动机信会不会太僵硬了？”“我的口语不那么好，法语面试应该如何准备？”类似的问题小满老师几乎每天都会看到，也能从你们的字里行间感受到你们对求职对面试的疑惑和焦虑。为了帮助大家顺利的找到国内外的优质实习，我们在红领巾的官网上开设了求职版块。每天定期更新欧洲/国内的优质实习资讯，大家可以直接在上面“一键投递”简历。求职版块哪里找（请在PC端打开）：http://www.51honglingjin.com/shixi 求职版块长这样：官网现已积累了满满17页的国内外优质实习岗位信息，还在每天持续更新中。欢迎大家去官网搜索实习信息、投递简历～当然，如果你有修改法语CV、动机信、面试上的困惑也可以咨询我们求职版块入驻的两位导师：小布老师和Lucien老师这两位导师的履历之前专门出过文章介绍，复习点这里：这两位法国职场老兵不仅可以帮你量身定制CV、动机信、帮你模拟面试还可以让你的简历绕过HR，直接出现在部门经理的办公桌上，会是你法国求职路上的神助攻～快去官网认领你的实习岗位吧！更多实习求职资讯请戳小满老师▽ 点 阅读原文 直接进入简历投递页面▼▼▼"
3,Toyota「發明之母」表揚華裔得獎者「垃圾變黃金」,星島洛杉磯版,ab735a258a90e8e1-6bee54fcbd896b2a-0ae3f9b51d6480fb246fbcd7e67618d6,為了慶祝3月8日國際婦女節，豐田汽車（Toyota）和Women in the World合作，8日於洛杉磯Lombardi House舉辦「Talk Shop」活動，邀請多位女性領秀對談，慶祝女性的創造力，探討女性創業者如何以極大的創造力，解決世界上最具挑戰性的問題。最新一屆的「發明之母（Mothers of Invention）」獲獎者—BioCellection的聯合創始人兼首席技術官姚佳韻（Jeanny Yao），也到活動現場，與超過百餘位女性對談。並且獲豐田汽車資深工程師Jacquelyn Birdsall頒發5萬美元的獎金，以支持姚佳韻與其合夥人汪郁雯（Miranda Wang）繼續發展她們的事業。年僅24歲的姚佳韻和25歲的汪郁雯是高中同學，兩人在大學期間創建了BioCellection，2016年畢業後搬到硅谷繼續發展。姚佳韻表示，她和汪郁雯在高中時就開始了塑料降解的研究，「當時是靠生物的方式，但是創業後發現生物的方法不是特別實用。」因此兩人轉換到化學技術方向，希望能解決塑料廢棄物的問題。塑料已經成為現代人生活中不可或缺的存在，姚佳韻認為塑料的普及有因可循，並且有其必要性，確實在衛生等方面，大幅提升了生活品質。然而塑料產品所造成的垃圾、環保問題也迫切需要解決。因此BioCellection發明了一種打破塑料分子間的化學鏈接的技術，可以將無法再生的塑料轉化為有價值的化學品。「如果我們可以把塑料恢復成原材料，再重新做成更有用的東西的話，是一個很好的循環經濟。」姚佳韻認為，現在的社會不需要發展更多的塑料替代品了，太多種的產品反而是一個問題，讓情況更加複雜。「回收工業的技術比較傳統，他們不知道如何處理新的東西。」BioCellection的目標是把既有的塑料轉化成有用的東西，而不是成為垃圾。目前世界上超過百分之30的塑料都是由聚乙烯（Polyethylene）製造的，而BioCellection已在實驗室中證明，可以將聚乙烯製的塑料轉化爲有經濟價值的化學產品。自2012年以來，豐田發明之母計劃已經挖掘了23位極具才智與創造力的女性，她們來自世界各地，以源源不斷的創意，持續的改善這個世界。豐田已經贊助了超過100萬的投資獎金，讓獲獎者們開發將各項新的技術，影響全世界超過1.6億人的生活，積極地為世界帶來改變。上网订阅星岛日报即日送报到府服务查看更多新闻详情
4,2012年Toyota丰田Sienna黎明灰,纽约威信汽车,ab735a258a90e8e1-6bee54fcbd896b2a-f620e2ca4477af2f8a46049a03c06096,"2012年Toyota Sienna 黎明灰，车况极好，10万3990Miles, 2.7L 187马力 L4引擎，6挡手自一体，5门7座，每加仑油耗：城市19英里/高速24英里/混合21英里，车配日间行车大灯，光感氙灯，绒布座椅，高级音响，17寸轮，可调节后视镜，多变间歇雨刮器，前置前驱，保养良好售：$9,995更多汽车2016年 Acura讴歌 RDX Advance Pkg 石墨灰2016年 Toyota丰田 Rav4 LE AWD 天空银2014年 Honda本田 CR-V LX AWD2016年 Volkswagen大众 Tiguan途观 TSI S AWD 夜魅蓝2018年 Infiniti英菲尼迪 QX60 AWD 石墨灰2015年 Lexus雷克萨斯 GX460 AWD Premium 银灰色2011年 Land Rover路虎 Range Rover Sport HSE 苏门塔黑2018年 Toyota丰田 Tundra坦途 1794 Edition 4WD 烟熏色2015年 Infiniti英菲尼迪 Q50 AWD 月光白2016年 Kia起亚 Soul秀尔 亮白色2013年 Toyota丰田 RAV4 XLE 纯黑色2015年 Lexus雷克萨斯 IS250 F-Sport AWD 极度白2016年 Lexus雷克萨斯 GX460 AWD 星火珍珠白2016年 Acura讴歌 RDX Tech Package AWD 钻石白汽车资讯本田，丰田和日产三大品牌比较2017年八大最佳紧凑型轿车评选十大主流汽车音响，快看看你的车都装了吗？BMW SUV全X系列-X1至X7的变化介绍TESLA特斯拉Model 3最终版终于现身了！！！雷克萨斯RX 7座版路试被捕获，第三排空间曝光！这些车型被评为2017年全球最烂车型，奔驰与丰田都包含其中！2017外媒评选的十大最安全的汽车品牌出炉，看看有你的爱车吗？美国媒体评出的5款最好的SUV小学堂汽车小学堂：CVT变速箱和AT变速箱哪个可靠耐用并且经济环保？汽车小学堂：汽车的11大反人类设计，真有那么好用吗？汽车小学堂：汽车12个很难被发现却很好用的配置汽车小学堂：汽车上最难找的5个按钮，20年老司机都不全知道汽车小学堂：汽车挡风玻璃被小石子砸了个洞，用这招$10就能搞定汽车小学堂：什么样的驾驶习惯会导致发动机积碳？汽车小学堂：A级车，B级车，C级车，D级车该怎么区分？纽约威信汽车请长按右侧二维码关注我们的微信公众号您将会得到：❶ 更多高品质二手车资源❷ 更多的汽车咨询和信息❸ 更方便的随时联系我们"
5,2019ToyotaBMX三重挑战赛第二站阿灵顿街式赛,CATCREW猫队,ab735a258a90e8e1-6bee54fcbd896b2a-c62aee11e5e594ec24996c45d8e48bfa,"     Toyota BMX三重挑战赛是一个三站系列赛，已经开展第五年了。它让顶尖的BMX车手汇聚在一起参加一场独特的土坡赛事，不断推动着BMX技术水平的提高。     这三项赛事中的每一项都将有多达50名车手参加公开资格赛，也就是说任何一个车手不管你是老Pro还是小萌新都有机会赢得总冠军。     今年一月份在阿纳海姆举行的第一站土坡挑战赛中由老牌飞行员Pat Casey夺得冠军。（精彩回顾：Toyota BMX三重挑战赛决赛圈）     然鹅，在第二站德克萨斯州阿灵顿彻底改变了玩法，采用了街式的feel。在场地设置上有ramps,、拖车、ersey barriers、 wallride墙以及各种杆子。     尤其值得一提的是，本次赛事充满街式风格的独特场地是由Kevin Peraza设计的！场地效果预览图     又是一个Pro云集的盛会，ins上不声不响，原来都偷偷跑来参加这次新赛事。下面快来过个眼瘾吧播放最终成绩     这次的挑战赛是以果酱赛形式，每位车手都有20分钟的时间做他们喜欢做的招，没有严格的规则，没有官方分数，不按套路走，完全取决于车手给评委留下的整体印象。这样的方式能够让车手可以专注于他们想要做的东西，而不是像完成任务一般，为了得分而做动作。     挑战赛的另一个独特元素是，最佳技巧比赛完全由车手自己评判。     有时候，当你热爱的事情上升到了竞技层面，就必须要遵守它的规则。而Toyota BMX三重挑战赛阿灵顿站这样的果酱赛不拘泥与形式、规则，释放了BMX的天性，随心而动。精彩瞬间恭喜外星人GR喜提冠军银牌得主Drew Bezanson铜牌得主Matty Ray最佳线路Mike Gray最佳技巧Dan Lacey"
6,2014年Toyota丰田Rav4XLEAWD激情蓝,纽约威信汽车,ab735a258a90e8e1-6bee54fcbd896b2a-4c372e1ac93abca8c5101b25f924a2bc,"2014年Toyota RAV4 XLE 激情蓝, 车况极好，3万8857Miles, 2.5L 176马力 L4引擎，6速手自一体变速，4门5座，每加仑油耗-城市22英里/高速29英里/混合25英里，0-60mph加速8.2秒，车配日间行车灯，自动感应式大灯，6.1寸大屏中控触控媒体系统，车载蓝牙，倒车摄像头，高级音响，外接USB+AUX音源接口，多功能方向盘，自动防眩目后视镜，17寸铝合轮，前置四轮驱动，一手车主， 保养良好！预售：$16,995更多汽车2016年 Acura讴歌 RDX Advance Pkg 石墨灰2016年 Toyota丰田 Rav4 LE AWD 天空银2014年 Honda本田 CR-V LX AWD2016年 Volkswagen大众 Tiguan途观 TSI S AWD 夜魅蓝2018年 Infiniti英菲尼迪 QX60 AWD 石墨灰2015年 Lexus雷克萨斯 GX460 AWD Premium 银灰色2011年 Land Rover路虎 Range Rover Sport HSE 苏门塔黑2018年 Toyota丰田 Tundra坦途 1794 Edition 4WD 烟熏色2015年 Infiniti英菲尼迪 Q50 AWD 月光白2016年 Kia起亚 Soul秀尔 亮白色2013年 Toyota丰田 RAV4 XLE 纯黑色2015年 Lexus雷克萨斯 IS250 F-Sport AWD 极度白2016年 Lexus雷克萨斯 GX460 AWD 星火珍珠白2016年 Acura讴歌 RDX Tech Package AWD 钻石白汽车资讯本田，丰田和日产三大品牌比较2017年八大最佳紧凑型轿车评选十大主流汽车音响，快看看你的车都装了吗？BMW SUV全X系列-X1至X7的变化介绍TESLA特斯拉Model 3最终版终于现身了！！！雷克萨斯RX 7座版路试被捕获，第三排空间曝光！这些车型被评为2017年全球最烂车型，奔驰与丰田都包含其中！2017外媒评选的十大最安全的汽车品牌出炉，看看有你的爱车吗？美国媒体评出的5款最好的SUV小学堂汽车小学堂：CVT变速箱和AT变速箱哪个可靠耐用并且经济环保？汽车小学堂：汽车的11大反人类设计，真有那么好用吗？汽车小学堂：汽车12个很难被发现却很好用的配置汽车小学堂：汽车上最难找的5个按钮，20年老司机都不全知道汽车小学堂：汽车挡风玻璃被小石子砸了个洞，用这招$10就能搞定汽车小学堂：什么样的驾驶习惯会导致发动机积碳？汽车小学堂：A级车，B级车，C级车，D级车该怎么区分？纽约威信汽车请长按右侧二维码关注我们的微信公众号您将会得到：❶ 更多高品质二手车资源❷ 更多的汽车咨询和信息❸ 更方便的随时联系我们"
7,2018年Toyota丰田4Runner超霸TRDOffRoad4x4午夜黑,纽约威信汽车,ab735a258a90e8e1-6bee54fcbd896b2a-1ddd0ffe1247995bf5dc8719aeed5add,"2018年Toyota 4Runner 午夜黑, 车况极好，3732Miles, 4.0L 270马力 V6引擎，5速手自一体变速，4门5座，每加仑油耗-城市17英里/高速20英里/混合18英里，0-60mph加速7.7秒，车配日间行车灯，自动感应式大灯，大屏中控触控媒体系统，GPS卫星导航，车载蓝牙，倒车摄像头，高级音响，外接USB+AUX音源接口，多功能方向盘，四轮驱动， 保养良好！预售：$35,9954Runner是丰田只在美国和加拿大销售的一款越野车，国内叫超霸、也叫福瑞纳（译音），共六种车型，作为普拉多的同胞兄弟，它在国内的知名度却一直没有打开，许多人对它知之甚少。在2018北美车展上，2018款丰田4Runner正式亮相，新车增加了两款TRD Off-Road配置车型，两款车都将于今年内在海外市场上市。4Runner一款以皮卡为底子打造的主攻越野型的SUV，4 Runner中文名字叫“超霸”。外观方面，张开大嘴般的进气格栅让超霸非常有力量感，格栅下还有一个粗壮的车身同色下包围护板，整体看上去非常有野性。大灯与格栅紧紧相连，大灯看上去非常凶狠霸气。20英寸的大轮毂，配备的是锻造式的轮毂，非常的坚实，碰到石头几乎是没有问题的，匹配的是越野式的轮胎，可以适应各种路况，可以提供很好的摩擦力。侧面来看，4Runner整个车身造型看起来较为方正，而方正的轮框设计看起来也更加硬派，宽大的D柱更是增加了几分硬汉的味道，不过还是那句话，这个汉子相比普拉多真的要细腻许多，车身尺寸方面。是标准五座的，七座选装，但后备箱比较高，选装第三排肯定很狭小，五座车后备箱有大型的储物暗格。车身线条平整，四四方方的感觉让流线车身泛滥的马路上增添一道别样的风景。丰田4Runner内饰方面，中控面板采用了更多的银色镀铬设计，4Runner为了提升档次还在内饰加装了木纹饰板，中控整体为黑色，与座椅的橙色相互搭配。淡化了居家感，但更加运动，配色也更耐脏。整体中控的设计是丰田家族式设计，用在这个级别的越野SUV上，易读易用，结实抗造。配置方面：其安全装备还是很齐全的，标配VSC（车身稳定控制系统）、TRAC（牵引力控制系统）、ABS（防抱死制动系统）、EBD(电子制动力分配）、BA（辅助刹车系统）、SST（双离合）、TPMS（轮胎压力检测）、RSCA（翻滚感应气囊保护）等，外观方面与高配车型也没有太大区别。内部配置方面多媒体显示系统、多功能方向盘、座椅电动调节、织物座椅也是一应俱全。主副驾驶电动座椅，电动可调节加热后视镜，电动门锁，倒车影像，外部温度显示，后尾电动车窗，后排隐私玻璃，自动变光内后视镜 多功能方向盘，蓝牙控制，地图灯，迎宾灯，地毯，脚垫，巡航定速，前后杯托。与普拉多不同的是，超霸车型的动力规格非常单一，采用4.0L V6 自然吸气发动机，最大功率201（kw），其最大输出功率可达270马力，峰值扭矩384牛米。此外还可以搭载另外一款排量2.7L的四缸发动机，最大输出功率为157马力，峰值扭矩为246牛米。传动方面依然配备的是那款老而弥坚的五速自动变速箱。与普拉多系列的全时四驱不同，4Runner（超霸）采用的是分时四驱系统。2018款丰田超霸作为一款地地道道的越野车型，新车的轮眉提升角度较大，与轮胎之间的距离足以满足您在不同的路面随心驰骋，加之20寸的轮毂配备，更使这部车充满了十足的越野味道。更多汽车2016年 Acura讴歌 RDX Advance Pkg 石墨灰2016年 Toyota丰田 Rav4 LE AWD 天空银2014年 Honda本田 CR-V LX AWD2016年 Volkswagen大众 Tiguan途观 TSI S AWD 夜魅蓝2018年 Infiniti英菲尼迪 QX60 AWD 石墨灰2015年 Lexus雷克萨斯 GX460 AWD Premium 银灰色2011年 Land Rover路虎 Range Rover Sport HSE 苏门塔黑2018年 Toyota丰田 Tundra坦途 1794 Edition 4WD 烟熏色2015年 Infiniti英菲尼迪 Q50 AWD 月光白2016年 Kia起亚 Soul秀尔 亮白色2013年 Toyota丰田 RAV4 XLE 纯黑色2015年 Lexus雷克萨斯 IS250 F-Sport AWD 极度白2016年 Lexus雷克萨斯 GX460 AWD 星火珍珠白2016年 Acura讴歌 RDX Tech Package AWD 钻石白汽车资讯本田，丰田和日产三大品牌比较2017年八大最佳紧凑型轿车评选十大主流汽车音响，快看看你的车都装了吗？BMW SUV全X系列-X1至X7的变化介绍TESLA特斯拉Model 3最终版终于现身了！！！雷克萨斯RX 7座版路试被捕获，第三排空间曝光！这些车型被评为2017年全球最烂车型，奔驰与丰田都包含其中！2017外媒评选的十大最安全的汽车品牌出炉，看看有你的爱车吗？美国媒体评出的5款最好的SUV小学堂汽车小学堂：CVT变速箱和AT变速箱哪个可靠耐用并且经济环保？汽车小学堂：汽车的11大反人类设计，真有那么好用吗？汽车小学堂：汽车12个很难被发现却很好用的配置汽车小学堂：汽车上最难找的5个按钮，20年老司机都不全知道汽车小学堂：汽车挡风玻璃被小石子砸了个洞，用这招$10就能搞定汽车小学堂：什么样的驾驶习惯会导致发动机积碳？汽车小学堂：A级车，B级车，C级车，D级车该怎么区分？纽约威信汽车请长按右侧二维码关注我们的微信公众号您将会得到：❶ 更多高品质二手车资源❷ 更多的汽车咨询和信息❸ 更方便的随时联系我们"
8,丰田|ToyotaSupraTRD在2月9日发布，官方质保，潜力巨大,CLauto酷乐汽车,ab735a258a90e8e1-6bee54fcbd896b2a-f97774ddd52769e7fbc203aaffe83149,Author / Constantine一个消息确凿了 —— Toyota Supra TRD Concept，2月9号即将发布。官方给的名字是 —— Toyota GR Supra Performance Line Concept TRD —— 如果硬是要翻译的话，叫丰田GR Supra TRD性能版，或者对，也或者不对。从目前仅有的一张概念图来看，越来越符合我们当初对Supra的认知，那个超级大尾翼的，动则一千匹的，可以干掉很多车的，创造无限可能得Supra。很多人说，全新Supra不够美，坦诚来说，新技术一定是比旧技术好，这一点我承认，但是如果说设计的话——30年，我觉得不会有什么巨大的进步——况且回头来看，那些最棒的审美，中国时期是在民国和现在，世界上伟大的作品都在文艺复兴的那些时候。丢勒自画像从波提切利到丢勒，从达达主义到波普艺术，年代相隔甚远，但是谁是更优秀？似乎没有人敢去下定论。如果说汽车也是艺术品的话，那某些可以被称为艺术的型号——Supra、Nsx AP1、Rx-7、22B等太多的经典，才可以被称为是“车”。丢勒-亚当与夏娃话题继续回到Toyota GR Supra Performance Line Concept TRD，丰田北美负责产品规划和战略的集团副总裁Andrew Coetzee表示说，在未来的战略中，丰田将全线开启TRD系列产品的售后工作，并且将推出一系列Supra TRD的特别版。虽然说，现在各类跑车都是“叫好不叫座”的产品——高昂的价格、缺少实用性的产品和各地限号以及拥堵、甚至包括来自家庭的压力和收入的压力。致使真正的跑车，在很多车迷的心中是一个图腾的符号，或者是梦中相会的“梦姑”（参考虚竹-天龙八部），却很难真正的走入生活，但是只要在主机厂里还有那些真正喜欢车的工程师和老板们，似乎真正的跑车“再温和的销量”，也不会阻挡人们对跑车的热爱。关于这辆TRD的Supra，至少3.0T可以原厂输出335马力和500Nm的峰值扭矩，而可能远远不仅于此，并且在将来，JDM也会有一系列的原厂改装件——就像那些德系的“罐头”程序与改件一样——而且还有质保和升级。还是喜爱万年不变的EJ系列引擎 —— 一个产品成为经典的要义之一，是生命周期足够长。 More 酷乐北京 | Lotus Elise赛道改装指南 —— 不以提高圈速为目的的改装都是耍流氓@Joe P1丰田 | 从猎装版到敞篷到大宽体的GRMN，新Supra改装让人十分期待克尔维特 | C7最终版本推出，橘色特殊涂装，锤不锤911GT3？迈凯伦 | McLaren 600LT Spider软顶赛道版上市，3.8T，起售价格201500英镑酷乐Project | 6台宝马E36合一，换装2JZ@温州大D P4车型详解 | NEVS：综合续航355公里，基于萨博93平台打造的纯电动汽车最快今年上市酷乐日签 | 2月2日 # 流浪日子 #点击阅读原文，看全部内容
