,Title,Account,ID,PostTime,Text
0,敏感专业户的护肤推荐-日本资生堂旗下dprogram，你用过了吗？,艾薇带你淘世界,ab735a258a90e8e1-6bee54fcbd896b2a-6f7ac49e8ad59cfd6ee8a25805ca39b0,document.write(timeConvert('1544281105'))2018-12-8,Ivy带你海淘全球好物点击上方蓝字关注公众号 艾薇带你淘世界 你也是敏感肌肤吗？根据日本市场调查发现，有七层的受调人认为自己是敏感性肌肤，但实际上只有一层是真正过敏体质，除此之外，大多数则属于有时会有时不会的反复性过敏肌“ときどき敏感肌”，也叫做“生活性敏弱肌肤”。所谓“生活性敏弱肌肤”，主要因为生活环境而引起的；比如睡眠不足、生活压力大、身体疲劳，季节变换等等而使肌肤的防御机能下降，造成痘痘粉刺、干燥脱皮、毛孔粗大等肌肤困扰。因此资生堂研究的这套系列主打调理，针对不稳定肌肤状况进行改善~日本资生堂旗下口碑最好之一的d program（敏感话题）系列，专业调理皮肤品牌。这个系列在本土比较火，屡次登上COSME大赏，由资生堂与日本尖端临床皮肤科专家一起研发，40多年来只针对敏感肌问题。整个系列涵盖了所有的年龄层，不管是哪个年龄段的敏感肌都要被拿下。尤其是大多数敏感肌品牌在抗氧化方面做的都不是特别好，那么可以首选这个系列。日本很多医生都推荐使用， 它不只是抗敏感，是真正解决你的肌肤烦恼！比皮肤科的药方更能长期保持你肌肤的稳定！d program系列产品以「d×d」美容新法来呵护敏感肌。所谓的「d×d」新美容法，就是以「defense（保护）×develop（滋养）」的护肤方式来塑造美肌。➤ defense 保护，保护肌肤不受日间各种环境影响，给肌肤最全面的保护。➤ develop滋养，也就是基础护肤系列，从卸妆、洁面、水乳到精华、面霜，调整肌肤屏障技能，给予皮肤生长的培育和修整。Develop ( 滋养 )d program敏感话题化妆水/乳液◆  ◆  ◆蓝色：混合性肌反复失衡。黄色：油性肌起痘。粉色：干性肌发红敏感。紫色：老化性干燥失衡。d program基础水乳搭配，四种常见不稳定皮肤症状，专业调理，集中改善，使皮肤恢复并保持正常稳定饱满的状态，持续水油平衡。蓝色系列 - 「混合性肌反复失衡」肌肤◆ 适合：混合性皮肤，脸上既有出油、毛孔明显、长痘等皮脂性问题，又有粗糙紧绷、浮粉、干燥、脱皮等干燥性问题混合出现的肌肤。◆ 功效：滋润、清爽两种类型，改善混合性皮肤“既干又油”状态，保持水油平衡，改善毛孔问题，使肌肤水润透明。黄色系列 - 「油性肌起痘」肌肤◆ 适合：油性皮肤，脸上容易长痘，肌肤粗糙，肤色不均人群。◆ 功效：集中调理改善出油、起痘的混乱症状。预防痘痘反复生长，改善痘痘及痘疤，调整肌肤纹理，使肌肤光滑细腻。粉色系列 - 「干性肌发红敏感」肌肤◆ 适合：干性皮肤，肌肤粗糙，容易浮粉的人群。◆ 功效：深层改善缺水症，为肌肤补充水分，缓解因干燥而产生发痒、发红等问题，预防改善干燥问题，调整肌肤纹理，维持肌肤状态稳定。紫色系列—「老化性干燥失衡」肌肤◆ 适合：皮肤弹性下降，一遇到干燥变容易长小细纹的“轻熟肌”，随着年龄增长肌肤变敏感、干燥等人群。◆ 功效：改善因老化引起的血液循环混乱，防止肌肤慢性敏感化，对老化性水分缺失，彻底改善干燥状态。保持肌肤弹性和透明感，令其保持滋润，让那些因干燥出现的小细纹变得不再明显。Defense ( 保护 )Allerbarrier系列◆  ◆  ◆Allerbarrier系列如同为肌肤上了一层“保护膜”，抵御肉眼看不见的PM2.5微粒子、花粉、粉尘等污染物以及紫外线对肌肤是侵害。用于肌肤护理之后，积极护理粗糙肌肤。全系列不使用紫外线吸收剂的无化学处方，温和安全，孕妇、婴幼儿也能使用。作为特别护理的妆前防御系列，Allerbarrier净化隔离系列。主要为防晒、BB、隔离。保护肌肤不受日间各种环境影响，给肌肤最全面的保护。Allerbarrier系列搭乘了资生堂新进的“净化隔离技术”，如同为肌肤上了一层“保护膜”，帮皮肤隔绝肉眼看不见的PM2.5微粒子、花粉、粉尘等污染物，以及紫外线对肌肤的侵害。杜绝过敏源，维持健康肌肤。Allerbarrier 保湿日用乳SPF30/PA+++防晒同时提高上妆质量，可以隔离花粉、粉尘等空气中的微粒子对皮肤的伤害。水润的质感，上脸非常清爽，除了隔离外部微粒子，这支日用乳最给力的就是保湿效果，有效防止肌肤干燥。Allerbarrier 保湿隔离物理防晒霜SPF40/PA+++传说中的“小奶瓶”，一只集合防晒，隔离，妆前打底三合一的美容液防晒隔离霜，不仅仅有SPF40的高效防晒系数，还能保持肌肤水润，可以作为妆前乳使用。白色乳液质地，清爽不会堵塞毛孔，很好推开。超级小一瓶，不过用量还算省。油皮表示，上脸很服帖不泛白，一天下来也无油光，很满意。Allerbarrier 防晒BB霜SPF40/PA+++在原有的防护体系基础上，增加了润色作用，轻薄而不厚重，能修正肤色、毛孔，打造滋润妆容。粉质很丝滑很细，保湿度非常够，很水润不搓泥，上脸不会有这种卡粉现象，真心素颜感。自然色和提亮色两种可以选择，10小时持续妆效。全系列产品百分百无添加香料、色素、酒精、防腐剂等，完全不刺激，皮肤易过敏者、孕妇、哺乳期的妈妈、还有问题肌肤都可以使用！敏感肌肤不用为找适合的护肤品而发愁了孕妇在孕期也终于可以安心护肤啦资生堂d program系列，因为够专业，所以值得被推荐！-the end-Ivy带你海淘全世界宝贝★分享★介绍★推荐★报价★测评随时随地分享实用资讯~
1,问题肌肤的安定剂：资生堂DProgram系列,Bo与Pea的美妆记录册,ab735a258a90e8e1-6bee54fcbd896b2a-4b6a756400e25d90f4b6ae6f95e95489,document.write(timeConvert('1547197238'))2019-1-11,首先请各位小仙女原谅我，时隔这么久我才来填上当初在流金水（润物细无声：IPSA流金水）中挖的坑，当时在文章末尾提到流金水的替换品，就是今天我要讲的资生堂D Program系列。因为这个系列只在日本出售，所以导致在日本以外名不见经传，我几乎没看到有博主推荐。别看在海外低调，但在日本的口碑很好，也是cosme大赏的常客。先简单介绍下这个系列，它是资生堂与日本顶尖临床皮肤科专家一起研发，主打专业调理肌肤的药妆线。以无色素、无酒精、无香料、低刺激，温和而又有针对性地呵护敏感肌肤而著称。粉色针对沙漠皮，黄色针对痘皮，蓝色针对“水油”反复失衡，紫色则是抗衰老。新版首先先聊下它们家水、乳的配方，其实四个系列的配方大思路是相同的，一如既往的体现许三多的拿手好戏。排名第一位的传明酸配合第二位的甘草酸二钾，美白抗炎；紧接其后的赤藓醇、甘油、丁二醇、木糖醇起到补水保湿的作用；然后四个系列分别添加针对不同肌肤问题的植物提取物，达到专业调理、集中改善的作用。D Program系列中间升级换代过一次，但找不到升级换代前的配方，所以不知道只是包装改变了，还是配方也有所变化。旧版粉色针对超干肌肤系列水约250多RMB，125ML乳约270多RMB，100ML粉水加的是迷迭香、氢化蓖麻油提取物，乳加的是迷迭香、柠檬百里香提取物，起到消炎修复和柔润肌肤的作用。这个系列添加的保湿剂比其他系列都要多，而且添加了增稠剂，所以这个系列的水乳会比其他系列更稠，也更保湿。它的水是透明无色、很稠但流动性又很好的质地，乳是乳白色的厚重质地，都没味道。虽然都很稠，但是上脸就化为很润的质地，延展性很好，基本一泵就能照顾全脸。吸收后，会有点略黏，但作为干皮而言很有安全感。当初读研期间拿自己当小白鼠试各种护肤品，硬生生地将自己作成沙漠皮不说，而且作的屏障受损，出现红血丝，是这套水乳拯救我于水火之中。一套用完，不但屏障修复的差不多了，而且红血丝也快消失看不见。另外，它的保湿力度超级强。我十一去烟台，海边大风加上强烈的紫外线，是这套水乳让我安全度过这几天。大家看我囤货图就知道，确认过眼神是遇见对的水乳没错。黄色针对痘皮系列水约230多RMB，125ML乳约250多RMB，100ML黄色系列水乳添加的是短柄野芝麻、黄檗树皮提取物，起到消炎、调理肌肤的作用。黄色是四个中添加保湿成分最少、没有添加增稠剂的系列，所以是其中质地最轻薄的系列。鉴于我只买了乳，所以水也无法反馈。虽然包装上乳写的是Emulsion（乳液），其实应该用Serum（精华液）更贴切。它是半透明流动性质地，无味，质地很轻薄，也很好推开，延展性应该是四个系列中最好的，半泵就能照顾全脸。这个系列不属于急救型，而是调理型的产品。如果涂了它指望痘痘会立马消下去，估计你会失望，但是它能在使用后几个星期内，对痘痘肌起到一个很好的调理作用。这个乳是给我舍友买的，他当时满脸都是痘，已经到无法见人的地步了。在用了几个星期后，他脸上的痘痘基本就消的差不多了，而且没有留下痘痕痘印，整个脸变得比以前干净很多，肌肤状态也比以前好，并且之后长痘也没以前严重了。所以一瓶还没用完，他托我赶紧又囤了一瓶替换装。唯一的缺点是冬天保湿力度会有所欠佳，在北方的小伙伴们可能需要后续叠加产品保湿。蓝色针对水油失衡系列水约250多RMB，125ML乳约270多RMB，100ML蓝色又分为清爽和滋润两种类型，添加的是黄檗树皮提取物和棕榈仁油，起到一个肌肤调节的作用。滋润型会比清爽型多添加保湿剂和增稠剂，所以滋润型会比清爽型更稠更保湿，当然价格也更贵一点。我只买了滋润型的乳液，一个混合偏干的朋友在我的推荐下买了一套滋润型，所以我去问了下她的反馈。她对这套水乳的滋润度还是挺满意的。在北京的冬天能维持大半天脸不干，而且吸收之后不会油腻，角质层也比以前柔嫩，但是“水油”平衡没有太大的感觉。从我朋友给我拍水的质地，包括我自己用蓝乳也的确能感受到，蓝色系列即使是滋润型都会比粉色系列轻薄一些，但又比黄色系列滋润度高很多，而且细分为两种滋润度，的确很好的照顾到不同类型的混合肌肤需求。紫色抗衰老系列水约330多RMB，125ML乳约370多RMB，100ML紫色系列是针对干燥性衰老的产品。它的水乳添加的是刺梨果、红芒柄花根、柠檬百里香提取物，抗炎舒缓、补水抗氧化一把抓。并且水乳中刺梨果、红芒柄花根提取物含量很高，仅次于传明酸和甘草酸二钾，排名第三第四，所以紫色是四个系列中最贵的。水分为滋润和清爽两个类型，乳则没有。就我个人而言，抗衰老这种事情，我一般愿意交给精华这个环节，所以对这个系列兴趣恹恹没去尝试，就不做过多评价。不过就目前三个系列用下来，它们家是属于那种不会立竿见影，但会逐渐将你的肌肤调整到一个很好的状态，所以我觉得应该也不会让人失望。但就配方来看这个系列保湿度估计很高，油皮同学看看就好。总的来说，资生堂的D Program系列是属于那种温和无酒精，用料精简，并且舍得用料的产品，算是日本护肤品中的一股清流。借助资生堂这个雄厚的靠山，共享品牌优质的配方和原料，将功效和肤感完美的融为一体。一套用下来的确觉得肌肤问题有所缓解，肌肤状态有明显的改善，不得不再次感慨一下日本的匠心精神。我给身边的朋友推荐，都是零差评的。另外，它们家的水乳都有替换装，正装用完之后泵头别丢，可以持续利用。然后，吐槽一下，泵头的开口也太大了，每泵挤的量有点大，而且用到还剩三分之一多，就有点挤不上来了。最后就是太难买了，一人血书跪求许三多引入国内！！！
2,资生堂旗下这个小众品牌也太好用了吧，居然好多人都不知道,MK凉凉,ab735a258a90e8e1-6bee54fcbd896b2a-202d964446ac2b8e9f0093ab7bf3c4e8,document.write(timeConvert('1545827458'))2018-12-26,Hey girls~这两天广州也算是真的过上冬天了，我是一边开心着可以把衣柜里的毛衣、大衣翻出来穿了，一边又痛苦着冬天一到皮肤是越来越干燥了。光是干也就算了，把保湿补水做好还可以坚持大半天。最担心的就是皮肤过敏，本来平时都不怎么过敏的人，每到冬天却很容易泛红、脱皮更是日常，还时不时刺疼、爆痘......苦涩~图：MYLOHAS后来才知道，这原来也是敏感肌的一种，属于敏感反复肌，是因为身边环境或者生活状态的改变，甚至是生理期前的压力造成的。可能很多人都和我一样，把这些偶尔出现的过敏不太当回事，无论护肤还是化妆都照旧，时间一长恐怕就会体会到皮肤真实地变差了，又要好久才能恢复回去。图：www.shiseido.co.jp/dp我现在如果发现自己有过敏的情况，像不必要的化妆可能就会停一下，如果稍微严重一点可能就只做简单的基础护肤，一来是可以让皮肤好好呼吸，再者也可以避免它接触一些致敏成分。所以，建议如果遇到皮肤出现反复敏感，还是要重视一下的。可能有的人还不知道自己是不是这种反复过敏的肌肤，那你可以先自查一下哦。如果以下情况满足其中1点，其实就是敏感肌了👇像日本妹子对于这类肌肤敏感就非常在意，所以去日本你可以看到专门针对这类情况而生的护肤品牌，也是我今天要给大家推荐的主角——资生堂的dprogram。它在日本可以说是相当火爆，但国内可能很多人还不熟悉它，所以我觉得这样的好东西有必要在这里分享给大家。虽然d program比它家其它网红品牌低调，但是实力却不输其它品牌，是个实实在在的宝藏品牌。d program一开始就是专门为敏感肌而生的品牌，是资生堂从事敏感肌研究40年的成果结晶。不仅护肤品是专门for敏感肌的，就连出的底妆产品也都是敏感肌可用，所有产品都是低刺激性的设计。它家是希望通过使用他们的产品可以做到外在防护改善敏感肌（defense），从内实现滋养皮肤让皮肤变得更美(develop)，反正就是为敏感肌好就对了。可以看到里面使用的成分也都最大限度地减少会刺激皮肤的情况发生，它家护肤品不含防腐剂、酒精、香料和色素，而且都通过了以敏感肌肤为对象的斑贴试验，这绝对不是说说而已。像它家卖得最好的水乳，全都是低刺激的弱酸性。加上包装的颜值也非常高，所以很多敏感肌的女生一旦用过d program之后，就会对它爱不释手。图：ins@dprogram_ofc虽然国内还没那么火，但是人家在日本可是创造了10年连续日本销售No.1的成绩呢，特别是它家的明星产品——针对不同肤质设计的4个系列的水乳，据说在日本每33秒就能卖出1瓶，口碑真的真的特别好。现在在国内没怎么宣传的情况下，小红书上也已经能看到越来越多人在推荐了。其实前面我已经提到了好几次了，没错！dp家最值得买的就是它家的水乳，敏感肌女孩儿的最爱。它家的水乳一共出了4个系列，每个系列针对不同肤质。虽然是敏感肌的产品，但功效显著，并不是很多人以为的敏感肌护肤品只要无功无过就好。它的每个系列都分了颜色，而且都是可爱小清新的马卡龙色，特别少女心。光看颜值就超种草的。我也是把这4个系列的水乳都get了一遍，准备测评一下到底有没有网上说的那么好用👇黄色：净痘护肤水+净痘护肤乳液适合肤质：易长痘的肌肤如果你为长痘所困扰，导致经常不知道选什么护肤品好，那推荐试试d program的这款黄色水乳。它就是专门给容易起痘的肌肤准备的，里面含有可以有效抑制痤疮桿菌的成分，所以是可以从源头上预防痘痘，而不是说长了痘才想着要怎么消痘。不仅不含防腐剂、无色素、无香料、弱酸性，而且也不含酒精和矿物油的（其实这4个颜色的水乳都是这样的），首先能减少对皮肤的刺激，再就是比较轻薄能够让皮肤更好地呼吸，对痘痘肌是再合适不过了。除了痘痘，连粉刺也可以有效预防哦~像有的宝宝会担心的护肤品太厚重导致长痘长粉刺的话，这个系列你就可以放心用。质地超轻薄！水的流动性很高，就连乳也是近乎透明的质地。吸收很快，用起来非常清爽舒服，完全没有粘腻感。下面是用完立马的粘腻度测试，大概十几秒之后，纸屑就一点都不会粘粘了，试用的时候真的被惊艳到了。清爽归清爽，但是你会发现用完之后皮肤是有变化的，会变得比使用前更柔软有弹性，而且听用过的妹子说虽然是预防痘痘，是祛痘效果也都是有的，长痘的时候在痘痘处多涂一点，痘痘就消得比较快，也不刺激，难怪那么多妹子爱它。蓝色：平衡护肤水 滋润型+平衡护肤乳液 滋润型适合肤质：混合型皮肤蓝色这个系列是针对混合型肤质的，什么意思呢？就是像很多宝宝都会有T区油，C区干的情况，那这款就可以起到调节皮肤水油平衡的情况，帮你改善这些干燥和出油的问题。它这款也是非常有心，考虑到有这个情况的皮肤还是有偏干或者偏油的类型，或者因为季节改变带来的变化，所以出了清爽和滋润两个版本，冬天的话我个人是更偏向滋润型的。这款的水要比黄色的稍微粘稠一丢丢，但使用感受也是清爽的，乳液相比常见的乳液流动性会更大一些。整体使用起来也是清透好吸收的。这款用完之后，除了比较水润之外，皮肤的触感会特别嫩滑有光泽感，而且你能看到毛孔也有缩小，整个皮肤的状态看起来会好很多。冬天混干皮表示已经很够用了。粉色：倍润护肤水+倍润护肤乳液适合肤质：干皮这款粉色其实看名字就是知道一定是非常润的，所以沙漠皮宝宝就可以看这里了。经常看到有的沙漠皮妹子皮肤干到起皮，就去用一些非常厚重的产品，但因为角质层薄反倒对于某些成分会有过敏的情况。而dp这个粉色系列的水乳是可以自然柔和地渗透滋润到干燥的角质层，能够在加强补水保湿的同时去调理皮肤的屏障功能，尽量减少敏感现象，所以也是很多沙漠皮妹子的爱。别看它是倍润，但质地依旧很清爽。它的水甚至比蓝色系列还要轻薄，乳液也是上手之后很快化成水吸收了，完全没有一些保湿水乳会出现的太厚重太闷导致皮肤不透气的情况。不仅是起皮的情况没有了，皮肤更加水润光滑。而且我们让工友小姐姐用水分测试仪测试了使用大半天之后的皮肤水油情况，依旧是可以保持在一个不错的状态。特别是冬天上妆之后容易起皮浮粉的女生，墙裂推荐dp家这个倍润系列，用完之后上妆真的要安心好多。紫色：塑颜焕活精华水 滋润型+塑颜焕活精华乳液适合肤质：有初老情况的皮肤可能提到针对敏感肌的护肤品，大家一般想到的都是基础护肤，比较少会听到说针对预防改善初老问题的产品。但既然是专做敏感肌产品的，当然是要面面俱到，所以紫色这款就是for有抗初老需求的妹子的。像二十几岁脸上刚刚开始有一些皮肤松弛、暗沉或者出现一些干纹细纹的情况，如果再加上过敏，皮肤衰老可能会更快。建议可以试试看这个紫色的塑颜焕活系列，它是可以做到一些改善和预防的。这款的水相比自家其它系列要稍微稠一丢丢，但对比市面上大部分的产品都是算舒爽的了，乳液倒是一如既往的清爽，整个用起来不会给皮肤造成负担。使用一段时间后，你会明显感觉到皮肤更有光泽感，而且一些干纹、细纹的地方也都有减淡不少，皮肤看上去是特别饱满有弹性的状态，人自然也看着会很有少女感。另外，除了这4款明星水乳，其实它家的很多底妆和清洁产品也是好评很多的。像洗面奶就是2018cosme美妆大赏洗颜部分第1位。同样也是不含添加剂的，含有不引起粉刺的配方。敏感肌用起来也比较安全放心，基本上什么肤质都能用，洗完也不会有假滑或者拔干的情况。同系列的卸妆油也都很不错。另外还有这款粉底也是好多敏感肌妹子的心头好，特别是对痘痘肌非常友好，粉质很细，也不闷痘。颜色也比较自然，很适合亚洲肤色，遮瑕力中等，整体得分还是不错了，很多痘痘肌妹子都说用过之后就一直在无限回购中。好啦，今天的品牌种草就聊到这儿了。最后来说说你用过这个品牌吗？对它的感受是什么样的？或者还有什么好的推荐，都可以在留言里和大家分享哦~编辑 丨 Amy如对本文文字、图片版权有疑问请联系bianji@fenxing.com，我们会尽快处理，比心~广告好看戳一戳好东西就是要分享给大家
