,Title,Account,ID,PostTime,Text
39,自从我入手了这些口碑超好的护肤品，做梦都在笑！,时尚百科书,ab735a258a90e8e1-6bee54fcbd896b2a-f82625e1a6fd654a58ad5bf67b2dee3f,document.write(timeConvert('1545187297'))2018-12-19,如果每天想要美美的出门，基本的护肤肯定少不了的，可是要涂抹那么厚重的护肤品，大家应该都是拒绝的。可是有没有清爽凉快的护肤品啊，有的！请美少女们认清自己的肤质，迎接护肤好物吧敏感性皮肤是一种问题性皮肤，任何肤质中都可能有敏感性肌肤。敏感肌肤的病理改变是角质层变薄，皮下毛细血管扩张后淤血后所呈现在面部的红色网状。造成敏感肌肤的原因：1、肌肤的屏障功能过于薄弱，无法抵御外界刺激。表现为泛红，发热，瘙痒、刺痛，红疹等不适现象。这一类通常是由于肌肤接触了激素类的东西。2、由于遗传因素造成肌肤及其敏感的敏感肌肤。敏感肌肤和过敏肌肤有什么区别吗？科普时间过敏是一种皮炎症状。从过敏原来看，可能对某种食物、药物、化学品等产生过敏现象。所以，过敏现象是一直存在的，但是只要避免过敏原，就能阻止过敏现象的发生。敏感肌肤有先天性和后天性之分。前者主要跟遗传及体质有关；后者主要与保养不当、太阳暴晒、等因素有关。所以只要保养得当，是可以修复的。所以敏感肌肤在选择护肤品也是要格外小心，种草时间到~敏感肌肤选择好物颜控的你可以果断入手，粉色的水乳对敏感肌的红血丝很有效果。能够深层改善缺水，并改善容易发痒、发红血丝等敏感肌肤，恢复稳定的状态。B5 玻尿酸水乳能够达成补水、修复、舒缓、提亮四重奏，提高肌肤保湿力，从而改善红点红血丝。含有的洋甘菊还能修护敏感肌和调整肤色不均。产品： Primera芙丽美娜水乳纯天然植物调理水乳，不仅是敏感肌，而且准妈妈也能使用。天然成分无刺激，净化镇定皮肤，使肌肤保持滋润，持续保湿，维稳皮肤水油平衡，抗敏修复。天然活泉，内含具有舒缓，减少刺激作用的活泉水。舒缓的同时还深润保湿，无厚重感，减少肌肤负担。谷氨酸能够平衡油脂，有效改善肌肤油光状态，除了在种草的路上要小心外，在其他方面也要多加注意，并且找出方法。改善方法1.找出感敏的原因，如花粉、保养品成分等2.适量温和清洁，如少用清洁面膜3.慎用化妆护肤品，如带酒精的产品Acne skin痤疮，俗称青春痘、粉刺、暗疮。痤疮(青春痘)是一种发生于毛囊皮脂腺的慢性皮肤病，多发于头面部，颈部，前胸后背等皮脂腺丰富的部位。最讨厌就是长痘痘了，可是为什么会长痘痘呢？大家有去理解过吗？可以细分为外部原因和内部原因。外部原因：个人卫生不佳、穿着过紧与身体摩擦过度的服饰、使用不适合自己的化妆品。提醒：床上用品和化妆工具都要进行定期清洗。内部原因：遗传、体内激素分泌紊乱、压力（情绪方面）、营养不良、药物（可的松）过量。不小心用错护肤品，脸部就能火山爆发，所以痘痘肌肤在选择护肤品一定要清爽，过于厚重就会闷痘~痘痘肌肤选择好物淡淡的草药清新味道，感觉用完痘痘都在治愈。化妆水质地清爽不油腻，作为二次清洁，还能起到软化角质的作用，而乳液是凝乳的质地，补水的同时也缓解干燥。法国药妆品牌，产品也是与皮肤科医生联系最为紧密的医学护肤品。爽肤水不仅有助于收缩毛孔，而且能调理油脂分泌，预防痘痘的产生；平衡乳清爽不油腻，能让肌肤恢复水油平衡状态。含有中药成分，水是淡褐色，但是味道不会很浓。主要用来湿敷，有效抑制痘痘。乳液也是含有中药成分，清爽不油腻，对于肌肤的修复效果很好。dry skin肤质细腻、较薄，毛孔不明显，皮脂分泌少。最明显的特征就是，皮肤干燥、缺少光泽，容易产生细小皱纹，对外界刺激比较敏感，皮肤容易通红。干性肌肤可以分为缺水性干性肌肤和缺油性干性肌肤：缺水性：这类肌肤皮脂腺没有问题，只是由于护理不当或其他原因导致肌肤极度缺水。使肌肤内部水分与皮脂失去平衡，导致皮脂分泌增加，出现“外油内干”的现象。重点：缺水最避忌就是使用吸油纸，补水才是王道，只要肌肤不缺水，油光就会自然消失了。缺油性：皮脂腺分泌少，因为肌肤不能及时、充分锁住水分而导致皮肤干燥。重点：补水的同时也要补充油脂。只要区分好自己是缺水还是缺油，那就能在选择产品上得心应手啦~干性肌肤选择好物澳洲小众品牌，清新简约的设计瓶身，还带有一点点磨砂感。甘菊玫瑰爽肤水补水好吸收；月见草平衡保湿乳液质地偏厚，保湿效果非常好。搭配使用皮肤状况会趋于稳定。干性肌肤记得要选择丰润型，深层净白美肌补水，紧致嫩白的乳液，实现持续滋润的保湿效果。还有胶原蛋白的提拉效果，使肌肤充满张力。美肌水主打安抚肌肤，能够有效锁住水分；乳液的设计师按压的，非常方便，主打滋养细腻肌肤，虽然乳液有点黏，但是吸收很快。含有泉芯PHC、三色堇提取物、透明质酸钠，有效令肌肤表层形成锁水状态，使肌肤密集补水保湿。Oily Skin油性皮肤是指油脂分泌旺盛、额头、鼻翼有油光、毛孔粗大、触摸有黑头、皮质厚不光滑、外观暗黄，皮肤偏酸性，弹性较佳，不易衰老。油性皮肤毛孔粗大患者，平时要多注意清洁脸部，多补水。虽然油性肌肤容易油光满面，但是也不能一天多次洗脸去油，因为是洗不掉的，只能控油！！！建议：早上使用温和的洗面奶，晚上使用皂基洗面奶（清洁力较强）。是不是油性肌肤就只能用洗面奶呢？不是的！找到适合的水乳，也能使肌肤清爽而不油腻，吃下酱酱的种草物吧~油性肌肤选择好物油性肌肤记得要选经典套装，盈润套装是适合干性肌肤的。对于学生党来说，虽然小贵，但是容量大碗啊，每天湿敷也能用上两个月，可以说是性比价高了。控油的同时也能美白，有效改善肤色暗沉，提亮了几个度。小清新的瓶身，看到就能感觉到清爽。这款水祛痘的同时能够有效调节油脂分泌，舒缓皮肤；乳液在保湿的基础上能改善油光，做到了一定的控油效果。如果你皮肤比较油，容易毛孔阻塞，长粉刺，那这款是你的首选！德妃是一个小众品牌，可以说是黛珂紫苏水的平价款。针对油脂分泌过剩，从而导致毛孔堵塞、长痘的肌肤，能够镇定消炎，质地轻薄不油腻。洁面后使用能够镇静缓解肌肤，给肌肤补充水分。乳液清爽保湿，不会有厚重感，打造水润嫩滑的肌肤。可能推荐的不一定适合你的肤质，护肤品是很主观的东西，毕竟适合别人的不一定适合你，所以不要盲目追随。希望大家多多研究，尽快找到一套适合自己的护肤品吧~—精彩推荐—
40,我发誓，绝对不买这只黑心唇膏！,日本药妆,ab735a258a90e8e1-6bee54fcbd896b2a-7a72034e5800086b5e4d5059219cdd6e,document.write(timeConvert('1544785233'))2018-12-14,没有几天就要进入新的一年了，很多品牌推出了各种新品，我这儿还没开始下雪，明年春夏新品就要发售了？赶紧看看有哪些值得入手的好东西吧~对了，平时CC酱会发一些新品资讯放到微博上，也会发一些日常，有兴趣的可以先去微博转一圈哦~兰蔻大理石唇膏发售时间：2019年1月1日参考价：330元+刚刚发售的圣诞限定可是闪瞎我的眼，还没缓过劲，19年春夏限定就要开始发售啦~首先我们来看看粉嫩系，五花肉唇膏。不不不，说错了，是大理石马卡龙唇膏。可能最近减肥眼花想吃肉，哈哈~这次的唇膏，从膏体到外壳都是变色的大理石甜美花纹，限量发售3种颜色，珊瑚色、粉色和玫瑰色，意思就是要抢哦~大理石纹是由膏体材料混合制作而成，每一支的花纹都是独一无二哟~可以说每一只都是专属款，那是不是意味着到时候假货也会很多呀，毕竟没有绝对的对比呀~ 它是一款有色润唇膏，更像是变色唇膏，颜色没有雾面口红饱满。YSL黑色夹心唇膏发售时间：2019年2月6日参考价：4300円税抜YSL之前发售过红色夹心唇膏，19年居然要发售黑色夹心了，视觉冲击感更加强烈！外层是情挑诱光水唇膏的水润显色美感，黑色夹心是丰唇精华，还有增色效果，擦上可以会立刻双唇饱满水润！ 一共发售8个色号，6色+2个限定色。日本是2月6号才开始发售哦~其他地区会早一点。No.1 Mad Nude淡粉色，很适合日常No.2 Dazzling Fuchsia桃粉色，没有很荧光，也不浮夸No.3 Insane Pink非常适合春天，很显气质的粉红色，有点俏皮可爱No.4 Exposing Coral珊瑚粉色，适合偏白肤色，涂上很显皮肤白No.5 Delirious Orange最喜欢这个颜色，也是8个颜色中最饱满的一个，偏橘调的橙色No.6 Lunatic Red这个和5号色有点像，颜色更偏红调No.7 Furious Gold限定香槟金色，显色度不是很强，带有浅浅的光泽，可以叠加其他唇膏，打造金属感No.8 Dramatic Plum限定梅子色，适合秋冬或者打造金属感妆容哼，这黑心唇膏不买那是不行滴~迪奥蓝星炫色唇膏发售时间：2019年1月1日参考价：4200円税抜2019春妆的迪奥蓝星炫色唇膏，也推出了4款新色，配色更加抢眼。外层柔雾色可以勾勒出双唇轮廓。内层夹心缎光色，可以点缀在双唇之中，营造完美和谐的渐层妆效，轻松创造甜美诱人的咬唇妆感，一抹双色、一试上瘾！顺滑的奶油质地，让上妆同时带来甜而不腻的舒适感受。#656糖彩浆果#546夹心泡泡﻿#353果样雪糕﻿#322可可拐杖﻿RIMMEL 芮谜5色眼影新色发售时间：2019年1月11日参考价：4300円税抜这个牌子，CC酱之前也有介绍过，最近在日本非常火。它是来自英国伦敦的开架品牌，始创于1834，为全球历史最悠久的化妆品牌之一。被法国集团Coty收购后，授权高丝KOSE集团为日本的代理商，拥有Rimmel在日本进口、制造、销售等权利。他家最出名的就是巧克力系列五色眼影盘，可以闻见醇厚的巧克力香气哦~虽然眼影都偏珠光，但是粉质细腻软糯，颗粒也很细。在开架品质中，和kate能够PK一下。巧克力眼影会细分2个系列，具体看右下角的皇冠颜色。白皇冠：偏哑光的微珠光系列，珠光感不是很强烈。红皇冠：经典珠光系列，红皇冠在日本更受欢迎一些，毕竟bingbing真的很不错，这个价格还不显廉价感。明年5色眼影发售1个新色，主打还是以巧克力色为主，新增了新色，#005樱花巧克力。粉色x巧克力，打造温柔眼妆。配色也非常适合日常，配色不突兀，很好上色，新手也能轻松完成。RIMMEL芮谜唇膏新色发售时间：2019年1月11日参考价：1300円税抜1月份还会发布巧克力唇膏新色，日系唇膏雾面哑光的比较少，多是滋润型为主。RIMMEL家的唇膏，滋润的同时，发色还很给力。贴合巧克力主题，这次的新色颜色很浓郁。质地柔滑，滋润又不会很粘腻，泛猪油光的感觉。  Lunasol 10色眼影发售时间：2019年1月11日参考价：10000円税抜LUNASOL日月晶采是嘉娜宝旗下的高端彩妆品牌，比较出名的就属他家的各种眼影了，在日杂以及美妆评选中都能看到它的身影。2019年，Lunasol将迎来20周年，所以推出了周年限定彩妆系列，以及一些产品的新色。时临春夏，并没有发售一些亮系，偏甜美的色号，还是以米棕色为主打，更显温柔和优雅。一众新品中，CC酱最心水的是10色眼影盘。在日系眼影盘中，很少有出10色的眼影盘，大多都是4-5个颜色。再看配色，颜色过渡的很柔和，循序渐进。可以当单色打底，也可以混合打造棕色系眼妆。一共有2个色号，远看真看不出差别，2号色会更偏暖调，更偏红棕色调。#01 Neutral Beige#02 Noble Beige资生堂d program药用唇部美容液发售时间：2019年1月21日参考价：1500円税抜11月底的时候，CC酱突然过敏了，毫无缘由的脸发红发烫。柜姐说是干燥引起的过敏，入手了资生堂d program的粉色水乳。哇塞，真的超级好用哦，连用3天，敏感的症状就消失了，补水能力也非常好。不过感觉乳液略粘腻，化妆水不错。d program敏感话题是资生堂旗下专攻敏感肌肤问题的，之前也给大家具体的介绍过。不过在药妆店的价格中等偏上，宣传也不是很到位，所以没有什么名气。自从入手了他家的水乳之后，对它还是有点改观的。2019年1月21日将发售唇部美容液，在照顾敏感肌肤的同时，还考虑到滋润敏感嘴唇。一共发售了3个颜色，甜美粉色，珊瑚米色，透明粉色。滋润保护的同时，还有淡淡的颜色，提亮气色。添加了药用活性成分，预防以及修复嘴唇干裂。含有70％护肤成分，长时间保持水分。低刺激性设计，无矿物油添加剂，无酒精。软管设计，易于携带。
41,水乳了解一下~下单有优惠！！快递快停运啦！提前备货！,圣奈海淘馆,ab735a258a90e8e1-6bee54fcbd896b2a-ff65be5fc27457142b5055e36a04bc7f,document.write(timeConvert('1546844182'))2019-1-7,水乳篇1sana豆乳水乳一套2极润水乳一套3资生堂4资生堂5芙丽芳丝水乳一号套装6雪肌精水乳套装7男士uno多效爽肤水绿：温和保湿款蓝：清爽保湿款1资生堂肌水2乐敦cc美白爽肤水3乐敦cc美白精华
42,真香系列丨我发誓，绝对不买这只黑心唇膏~,聆听日本,ab735a258a90e8e1-6bee54fcbd896b2a-8c34e39399c012ab78942f250d952f4c,document.write(timeConvert('1546855229'))2019-1-7,没有几天就要进入新的一年了，很多品牌推出了各种新品，我这儿还没开始下雪，明年春夏新品就要发售了？赶紧看看有哪些值得入手的好东西吧~兰蔻大理石唇膏发售时间：2019年1月1日参考价：330元+刚刚发售的圣诞限定可是闪瞎我的眼，还没缓过劲，19年春夏限定就要开始发售啦~首先我们来看看粉嫩系，五花肉唇膏。不不不，说错了，是大理石马卡龙唇膏。可能最近减肥眼花想吃肉，哈哈~这次的唇膏，从膏体到外壳都是变色的大理石甜美花纹，限量发售3种颜色，珊瑚色、粉色和玫瑰色，意思就是要抢哦~大理石纹是由膏体材料混合制作而成，每一支的花纹都是独一无二哟~可以说每一只都是专属款，那是不是意味着到时候假货也会很多呀，毕竟没有绝对的对比呀~ 它是一款有色润唇膏，更像是变色唇膏，颜色没有雾面口红饱满。YSL黑色夹心唇膏发售时间：2019年2月6日参考价：4300円税抜YSL之前发售过红色夹心唇膏，19年居然要发售黑色夹心了，视觉冲击感更加强烈！外层是情挑诱光水唇膏的水润显色美感，黑色夹心是丰唇精华，还有增色效果，擦上可以会立刻双唇饱满水润！ 一共发售8个色号，6色+2个限定色。日本是2月6号才开始发售哦~其他地区会早一点。No.1 Mad Nude淡粉色，很适合日常No.2 Dazzling Fuchsia桃粉色，没有很荧光，也不浮夸No.3 Insane Pink非常适合春天，很显气质的粉红色，有点俏皮可爱No.4 Exposing Coral珊瑚粉色，适合偏白肤色，涂上很显皮肤白No.5 Delirious Orange最喜欢这个颜色，也是8个颜色中最饱满的一个，偏橘调的橙色No.6 Lunatic Red这个和5号色有点像，颜色更偏红调No.7 Furious Gold限定香槟金色，显色度不是很强，带有浅浅的光泽，可以叠加其他唇膏，打造金属感No.8 Dramatic Plum限定梅子色，适合秋冬或者打造金属感妆容哼，这黑心唇膏不买那是不行滴~迪奥蓝星炫色唇膏发售时间：2019年1月1日参考价：4200円税抜2019春妆的迪奥蓝星炫色唇膏，也推出了4款新色，配色更加抢眼。外层柔雾色可以勾勒出双唇轮廓。内层夹心缎光色，可以点缀在双唇之中，营造完美和谐的渐层妆效，轻松创造甜美诱人的咬唇妆感，一抹双色、一试上瘾！顺滑的奶油质地，让上妆同时带来甜而不腻的舒适感受。#656糖彩浆果#546夹心泡泡﻿#353果样雪糕﻿#322可可拐杖﻿RIMMEL 芮谜5色眼影新色发售时间：2019年1月11日参考价：4300円税抜这个牌子，最近在日本非常火。它是来自英国伦敦的开架品牌，始创于1834，为全球历史最悠久的化妆品牌之一。被法国集团Coty收购后，授权高丝KOSE集团为日本的代理商，拥有Rimmel在日本进口、制造、销售等权利。他家最出名的就是巧克力系列五色眼影盘，可以闻见醇厚的巧克力香气哦~虽然眼影都偏珠光，但是粉质细腻软糯，颗粒也很细。在开架品质中，和kate能够PK一下。巧克力眼影会细分2个系列，具体看右下角的皇冠颜色。白皇冠：偏哑光的微珠光系列，珠光感不是很强烈。红皇冠：经典珠光系列，红皇冠在日本更受欢迎一些，毕竟bingbing真的很不错，这个价格还不显廉价感。明年5色眼影发售1个新色，主打还是以巧克力色为主，新增了新色，#005樱花巧克力。粉色x巧克力，打造温柔眼妆。配色也非常适合日常，配色不突兀，很好上色，新手也能轻松完成。RIMMEL芮谜唇膏新色发售时间：2019年1月11日参考价：1300円税抜1月份还会发布巧克力唇膏新色，日系唇膏雾面哑光的比较少，多是滋润型为主。RIMMEL家的唇膏，滋润的同时，发色还很给力。贴合巧克力主题，这次的新色颜色很浓郁。质地柔滑，滋润又不会很粘腻，泛猪油光的感觉。  Lunasol 10色眼影发售时间：2019年1月11日参考价：10000円税抜LUNASOL日月晶采是嘉娜宝旗下的高端彩妆品牌，比较出名的就属他家的各种眼影了，在日杂以及美妆评选中都能看到它的身影。2019年，Lunasol将迎来20周年，所以推出了周年限定彩妆系列，以及一些产品的新色。时临春夏，并没有发售一些亮系，偏甜美的色号，还是以米棕色为主打，更显温柔和优雅。一众新品中，小编最心水的是10色眼影盘。在日系眼影盘中，很少有出10色的眼影盘，大多都是4-5个颜色。再看配色，颜色过渡的很柔和，循序渐进。可以当单色打底，也可以混合打造棕色系眼妆。一共有2个色号，远看真看不出差别，2号色会更偏暖调，更偏红棕色调。#01 Neutral Beige#02 Noble Beige资生堂d program药用唇部美容液发售时间：2019年1月21日参考价：1500円税抜11月底的时候，小编突然过敏了，毫无缘由的脸发红发烫。柜姐说是干燥引起的过敏，入手了资生堂d program的粉色水乳。哇塞，真的超级好用哦，连用3天，敏感的症状就消失了，补水能力也非常好。不过感觉乳液略粘腻，化妆水不错。d program敏感话题是资生堂旗下专攻敏感肌肤问题的，之前也给大家具体的介绍过。不过在药妆店的价格中等偏上，宣传也不是很到位，所以没有什么名气。自从入手了他家的水乳之后，对它还是有点改观的。2019年1月21日将发售唇部美容液，在照顾敏感肌肤的同时，还考虑到滋润敏感嘴唇。一共发售了3个颜色，甜美粉色，珊瑚米色，透明粉色。滋润保护的同时，还有淡淡的颜色，提亮气色。添加了药用活性成分，预防以及修复嘴唇干裂。含有70％护肤成分，长时间保持水分。低刺激性设计，无矿物油添加剂，无酒精。软管设计，易于携带。如果喜欢这篇文章，欢迎分享朋友圈~
43,敏感肌护肤品不止雅漾理肤泉,我与小胖哥辛先森的日常,ab735a258a90e8e1-6bee54fcbd896b2a-6e0a4805997bb3d65ef6476eaf89e673,document.write(timeConvert('1550132505'))2019-2-14,“ 换季结束仍是一条好汉”哈喽大家好，春节假期很快又结束了，大家胖了没有啊一天八顿自我投喂+爸爸妈妈爱的关怀回来见到男朋友说我像是在备孕...kk不哭还有更糟糕的换、季、要、到、了姐妹们没错，就是那个柳絮杨絮传播后代口罩也挡不住过敏红肿脸的春天要来了荒漠敏感皮简直重灾好么红血丝多的感觉自己像大山里的孩子还又疼又肿就想做个美美的小天使怎么办给大家安利些个人觉得好用的单品洁面                                                  D program D program是资生堂爸爸旗下针对20+的一个品牌整个牌子主打温和，低刺激，保湿，抗敏这款洗面奶大概是我用过之后脸部刺激最小、干净又不紧绷的一款了价钱又比Skii的洁面便宜效果远好于芙丽芳丝▽free plus也算是敏感肌洁面必推单品了吧无论是Cosme大赏，还是去日本药妆店上架推荐，这款都是No.1了个人觉得揉开时不够细腻，有点颗粒感，保湿效果不如D家有的妹子觉得好用，还是要看个人平价洁面中的战斗机，可以一试▽精华DECORTE不好意思作为一个荒漠敏感皮，精华我只服黛珂小紫瓶啫喱状，用完完全不过敏，换不换季我都用人家就是好用我能说什么呢每次去日本银座黛珂装柜必屯小紫瓶她家除了精华、眼霜、防晒、卸妆我觉得很好用之外其他水乳我、都、过、敏就这个我可以拍着胸脯说买吧，绝对不过敏▽水乳D program资生堂爸爸怎么能这么厉害旗下高端品牌也就算了，二线品牌也可以做得这么好之前我尝试过很多水乳品牌包括去台湾玩时买的宠爱之名等等每次到了冬天、还有换季我的脸就像洗衣板一样皴裂、起皮、红血丝用什么都肿直到我去日本遇到了D系列后来再尝试其他日系品牌的水乳黛珂家的植物韵律、pola家的红BA、Cpb家的水乳、Three家的平衡系列不好意思，全、都、过、敏▽她家水乳分四种蓝色水油平衡，黄色油皮痘痘肌，粉色极度保湿，紫色抗老如果你没有别的肌肤问题，只是过敏蓝色是最佳choice夏天I号清爽，冬天II号滋润心服口服我愿意跪着卖她家安利面霜珂润这款也非常有名了吧相比其他Cosme榜单代购炒出来的个人感觉这款作为平价面霜头牌实至名归作为面霜，便宜，镇定作用非常好缺点是量小像我这种大脸，一瓶就够撑俩月不到可以说除了夏天，其他时间必备▽雅漾雅漾真的算是每个敏感肌入门第一件了吧最有名的就是她家的大喷虽然对于正常肌肤来说就是一瓶矿泉水这里推荐她家的高效保湿面霜保湿度特别强我一直拿它和珂润替换用▽眼霜    DECORTE黛珂的眼霜质地和精华很像都是啫喱状用指腹推开即可保湿程度适合11-4月也不会营养过剩起脂肪粒（比如La prairie，大概是消受不起）▽科颜氏科颜氏的牛油果眼霜也是如雷贯耳一般眼霜入门都推这个我用着觉得还可以就是，姐妹们用前一定要乳化好如果不想起脂肪粒的话也是适合冬天使用▽珂润对，还有珂润的眼霜同样平价好用质地偏清爽，适合夏天使用针对年龄20+▽                                                      基本上就是这样啦有兴趣的小伙伴可以根据自己的皮肤状况、消费能力购买记住一定要找正规代购能自己去日本带的当然最好啦希望大家都是美美的小仙女~👇👇👇
